{
  "mode": "strict",
  "tools": {
    "codeAnalyzer": {
      "mode": "precise",
      "threshold": 70,
      "maxFiles": 50,
      "diffOnly": false
    },
    "bugDetector": {
      "mode": "precise",
      "severity": "all",
      "maxResults": 100,
      "maxFiles": 200,
      "diffOnly": false
    },
    "dependencyGraph": {
      "depth": 5,
      "maxFiles": 500,
      "diffOnly": false
    },
    "testGenerator": {
      "framework": "jest",
      "diffOnly": false,
      "includePrivate": false
    },
    "refactorEngine": {
      "mode": "precision",
      "dryRun": true,
      "diffOnly": false
    },
    "reviewTool": {
      "mode": "precise",
      "minHighConfidenceRatio": 0.7,
      "focus": "all",
      "diffOnly": false
    }
  },
  "context": {
    "linesPerFile": 60,
    "totalLines": 200
  },
  "planFirst": {
    "enabled": true,
    "maxPlanAgeMs": 1800000
  },
  "routing": {
    "defaultAgent": "main-orchestrator",
    "preferStrongModelForWrite": true,
    "escalationRules": [],
    "maxDepth": 3,
    "maxNodesPerChain": 5,
    "maxParallelDelegations": 2
  },
  "agentModels": {
    "main-orchestrator": {
      "model": "openrouter/openai/gpt-5.2",
      "modelParameters": {
        "reasoning": {
          "effort": "high"
        }
      }
    },
    "code-architect": {
      "model": "openrouter/anthropic/claude-opus-4.6"
    },
    "code-reviewer": {
      "model": "openrouter/anthropic/claude-opus-4.6"
    },
    "bug-hunter": {
      "model": "openrouter/openai/gpt-5.2-codex"
    },
    "refactor-bot": {
      "model": "openrouter/openai/gpt-5.2-codex"
    },
    "test-writer": {
      "model": "openrouter/openai/gpt-5.2-codex"
    },
    "perf-optimizer": {
      "model": "openrouter/openai/gpt-5.2",
      "modelParameters": {
        "reasoning": {
          "effort": "high"
        }
      }
    },
    "explore": {
      "model": "openrouter/google/gemini-3-flash-preview"
    },
    "PluginBuilder": {
      "model": "openrouter/anthropic/claude-opus-4.6"
    },
    "second-opinion": {
      "model": "openrouter/anthropic/claude-opus-4.6"
    }
  },
  "approval": {
    "enforce": false,
    "ttlMs": 600000,
    "defaultReason": "manual-approval",
    "contextRules": []
  },
  "verification": {
    "enforceOnMutation": true,
    "minCoverage": 80
  },
  "strictControl": {
    "enabled": true,
    "enforceRedlines": true,
    "recordOnly": false,
    "mcpEnabled": true,
    "mcpAllowlist": [],
    "mcpDenylist": [],
    "mcpCapabilityRules": [],
    "delegationMaxDepth": 3,
    "delegationMaxNodesPerChain": 5,
    "delegationReturnDeadlineMs": 600000
  },
  "compatibility": {
    "enableExperimentalCompaction": true,
    "enableSystemTransform": true,
    "enableDelegationRuntime": true,
    "enableVerificationContract": true,
    "enableChatMessagesTransform": true,
    "enableTextCompleteHook": false,
    "enableAuthHook": false,
    "enableCompactionRescue": true
  },
  "storage": {
    "delegationsTTL": "7d",
    "thoughtsTTL": "30d",
    "maxPromptLength": 10000,
    "maxResultLength": 50000,
    "maxAgentLength": 100,
    "maxTitleLength": 200,
    "maxContentLength": 50000
  },
  "skills": {
    "enabled": true,
    "allowlist": [],
    "loadFromDirectory": true,
    "directory": ".opencode/skills",
    "defaultRiskLevel": "medium"
  },
  "secondOpinion": {
    "enabled": true,
    "minMutationsBeforeTrigger": 0,
    "tier1TimeoutMs": 5000,
    "tier2TimeoutMs": 8000,
    "tier1Agent": "second-opinion",
    "tier2Agent": "code-reviewer",
    "escalateConfidenceThreshold": 0.72,
    "maxEscalationsPerSession": 2
  }
}
